{
  "researchIssueId": "49494949-4949-4494-8494-494949494949",
  "researchIssueVersionId": "50505050-5050-4505-8505-505050505050",
  "versionNumber": 1,
  "title": "Semantic function of prefixed lamed in the fixture construction",
  "questionText": "Which semantic functions should be evaluated for the prefixed lamed in the fixture construction?",
  "issueType": "SEMANTIC",
  "debateStatus": "ONGOING",
  "classificationBasis": "Fixture only; no field-wide consensus claim.",
  "literatureSnapshotId": null,
  "reviewStatus": "NEEDS_REVIEW",
  "contentHash": "1414141414141414141414141414141414141414141414141414141414141414",
  "supersedesVersionId": null
}
